{
  "format": "soc-game-project",
  "version": 1,
  "name": "mario-original-engine-grounds",
  "scene": "world.json",
  "port": {
    "kind": "custom",
    "render_repeat_safe": true,
    "render_interpolation": true,
    "sources": [
      "../../../firmware/ports/castle_engine.c",
      "../../../firmware/ports/castle_rules.c",
      "../../../firmware/src/world.c",
      "../../../firmware/src/camera.c",
      "../../../firmware/src/animation.c",
      "../../../firmware/src/game_services.c",
      "../../../firmware/ports/castle_controller.c",
      "../../../firmware/ports/castle_gameplay.c",
      "../../../firmware/src/game_memory.c"
    ],
    "exports": [
      "world_select",
      "world_collision",
      "world_floor_contact",
      "world_exit_find",
      "world_prepare",
      "world_draw",
      "world_transition_find",
      "world_areas",
      "player_bind_query",
      "player_floor_index",
      "camera_boom",
      "camera_orbit_step",
      "castle_floor_event",
      "player_move_horizontal",
      "player_step_motion",
      "world_draw_instance",
      "castle_controller_reset",
      "castle_controller_step",
      "castle_gameplay_init",
      "castle_gameplay_enter",
      "castle_gameplay_step",
      "castle_gameplay_stars",
      "castle_gameplay_keys",
      "castle_gameplay_frozen",
      "castle_gameplay_mission",
      "castle_gameplay_probe",
      "castle_gameplay_draw",
      "animation_step_clip",
      "game_movement_heading",
      "game_object_resolve_box",
      "memset",
      "memcpy",
      "memmove",
      "sm64_engine_init",
      "sm64_engine_update",
      "sm64_engine_probe"
    ]
  }
}
