{
  "format": "soc-game-project",
  "version": 1,
  "name": "mario-castle",
  "scene": "world.json",
  "port": {
    "kind": "custom",
    "sources": [
      "../../firmware/ports/castle.c",
      "../../firmware/ports/castle_rules.c",
      "../../firmware/src/world.c",
      "../../firmware/src/camera.c",
      "../../firmware/src/animation.c",
      "../../firmware/src/game_services.c"
    ],
    "exports": [
      "world_select",
      "world_collision",
      "world_floor_contact",
      "world_exit_find",
      "world_prepare",
      "world_draw",
      "world_transition_find",
      "world_areas",
      "player_bind_query",
      "player_floor_index",
      "camera_boom",
      "camera_orbit_step",
      "castle_floor_event"
    ]
  }
}
